{
  "schema_version": "1.0",
  "session_id": "5f2c1e10-9a3b-4c22-8f77-1a2b3c4d5e6f",
  "created_at": "2026-08-30T09:00:00Z",
  "updated_at": "2026-08-30T09:12:44Z",
  "commander": {
    "human": true,
    "name": "DSF Commander"
  },
  "last_good_checkpoint": "cp-002",
  "agents": [
    {
      "name": "dsf-commander",
      "model": "claude-opus-4-6",
      "model_version": "claude-opus-4-6-20260501",
      "runtime": "antigravity",
      "role": "Orchestrierung / Verifikation",
      "temperature": 0,
      "seed": null,
      "status": "in_progress",
      "current_task": "Recherche-Ergebnis von Gemini verifizieren"
    },
    {
      "name": "researcher",
      "model": "gemini-3.1-pro",
      "model_version": "gemini-3.1-pro-2026-07",
      "runtime": "antigravity",
      "role": "Recherche",
      "temperature": 0.2,
      "seed": 42,
      "status": "done",
      "current_task": "Marktrecherche DSGVO-Tools"
    },
    {
      "name": "worker",
      "model": "qwen-32b",
      "model_version": "qwen2.5-32b-instruct",
      "runtime": "cloud-sandbox",
      "role": "Bulk / Worker",
      "temperature": 0.1,
      "seed": 7,
      "status": "idle",
      "current_task": ""
    }
  ],
  "journal": [
    {
      "ts": "2026-08-30T09:05:10Z",
      "agent": "researcher",
      "model": "gemini-3.1-pro",
      "model_version": "gemini-3.1-pro-2026-07",
      "action": "Recherche zu DSGVO-Pruefkriterien",
      "inputs_ref": "AGENTS.md@85173c3; prompt=research/dsgvo.md",
      "result": "5 Kriterien vorgeschlagen",
      "verified_by": "",
      "status": "done",
      "checkpoint": false,
      "next_step": "Ergebnis durch dsf-commander verifizieren lassen"
    },
    {
      "ts": "2026-08-30T09:08:31Z",
      "agent": "dsf-commander",
      "model": "claude-opus-4-6",
      "model_version": "claude-opus-4-6-20260501",
      "action": "Verifikation der Recherche gegen Primaerquellen",
      "inputs_ref": "journal[0].result",
      "result": "3 von 5 Kriterien belegt, 2 unbelegt (moegliche Halluzination) verworfen",
      "verified_by": "dsf-commander",
      "status": "recovered",
      "checkpoint": true,
      "error": "2 Kriterien ohne Quelle -> Zero-Trust: nicht uebernommen",
      "next_step": "worker beauftragen, belegte Kriterien umzusetzen"
    },
    {
      "ts": "2026-08-30T09:12:44Z",
      "agent": "dsf-commander",
      "model": "claude-opus-4-6",
      "model_version": "claude-opus-4-6-20260501",
      "action": "Checkpoint gesetzt",
      "result": "cp-002",
      "verified_by": "dsf-commander",
      "status": "done",
      "checkpoint": true,
      "next_step": "Worker-Task starten"
    }
  ]
}
